{
  "$schema":"https://json-schema.org/draft/2020-12/schema","title":"NIKKE Raw Skill Lv.10 Buff Effect","type":"object",
  "required":["character_name","skill_name","skill_slot","target","target_type","buff_type","value","value_unit","duration","trigger","condition","stack_count","max_raw_value","source_url","notes"],
  "properties":{"character_name":{"type":"string"},"skill_name":{"type":"string"},"skill_slot":{"enum":["Skill 1","Skill 2","Burst"]},"target":{"type":"string"},"target_type":{"enum":["self","all_allies","selected_allies","class","weapon","element","other"]},"buff_type":{"enum":["atk","caster_atk_based_atk","attack_damage","core_damage","element_damage","critical_rate","critical_damage","charge_speed","charge_damage","reload_speed","max_ammo","hit_rate","def","caster_def_based_def","max_hp","caster_max_hp_based_hp","damage_taken","burst_cooldown_reduction","burst_gauge_related","pierce_damage","hp_recovery_healing_potency","other"]},"value":{"type":["number","boolean","null"]},"value_unit":{"enum":["percent","caster_atk_percent","caster_def_percent","caster_max_hp_percent","seconds","boolean","conversion","flat_value"]},"duration":{"type":"string"},"trigger":{"type":"string"},"condition":{"type":"string"},"stack_count":{"type":["integer","null"]},"max_raw_value":{"type":["number","null"]},"source_url":{"type":"string","format":"uri"},"notes":{"type":"string"},"source_text":{"type":"string"}}
}
