[
{"character_name":"Crown","skill_name":"One for All","skill_slot":"Skill 1","target":"直前にBurst Skillを使用した味方全員","target_type":"selected_allies","buff_type":"caster_atk_based_atk","value":64.51,"value_unit":"caster_atk_percent","duration":"15 sec","trigger":"Full Burst開始時","condition":"Previously cast their Burst Skills","stack_count":null,"max_raw_value":64.51,"source_url":"https://nikke.gg/characters/crown/","notes":"ATK%とは別カテゴリ","source_text":"ATK ▲ 64.51% of caster's ATK for 15 sec."},
{"character_name":"Crown","skill_name":"One for All","skill_slot":"Skill 1","target":"直前にBurst Skillを使用した味方全員","target_type":"selected_allies","buff_type":"reload_speed","value":44.35,"value_unit":"percent","duration":"15 sec","trigger":"Full Burst開始時","condition":"Previously cast their Burst Skills","stack_count":null,"max_raw_value":44.35,"source_url":"https://nikke.gg/characters/crown/","notes":"","source_text":"Reloading Speed ▲ 44.35% for 15 sec."},
{"character_name":"Crown","skill_name":"One for All","skill_slot":"Skill 1","target":"Burst未使用の味方全員","target_type":"selected_allies","buff_type":"caster_def_based_def","value":37.44,"value_unit":"caster_def_percent","duration":"15 sec","trigger":"Full Burst開始時","condition":"Did not previously cast their Burst Skills","stack_count":null,"max_raw_value":37.44,"source_url":"https://nikke.gg/characters/crown/","notes":"DEF%とは別カテゴリ","source_text":"DEF ▲ 37.44% of caster's DEF for 15 sec."},
{"character_name":"Crown","skill_name":"One for All","skill_slot":"Skill 1","target":"Burst未使用の味方全員","target_type":"selected_allies","buff_type":"reload_speed","value":44.35,"value_unit":"percent","duration":"15 sec","trigger":"Full Burst開始時","condition":"Did not previously cast their Burst Skills","stack_count":null,"max_raw_value":44.35,"source_url":"https://nikke.gg/characters/crown/","notes":"別条件の独立レコード","source_text":"Reloading Speed ▲ 44.35% for 15 sec."},
{"character_name":"Crown","skill_name":"Royal Attire","skill_slot":"Skill 2","target":"自身","target_type":"self","buff_type":"hp_recovery_healing_potency","value":4.06,"value_unit":"percent","duration":"継続","trigger":"通常攻撃時","condition":"Relaxを付与。20スタックまで","stack_count":20,"max_raw_value":81.2,"source_url":"https://nikke.gg/characters/crown/","notes":"実戦中の維持率は計算しない","source_text":"HP Potency ▲ 4.06% continuously. stacks up to 20 time(s)."},
{"character_name":"Crown","skill_name":"Royal Attire","skill_slot":"Skill 2","target":"自身","target_type":"self","buff_type":"other","value":true,"value_unit":"boolean","duration":"5 sec","trigger":"Relaxが最大スタック時","condition":"スタック消費後","stack_count":null,"max_raw_value":null,"source_url":"https://nikke.gg/characters/crown/","notes":"Invulnerable","source_text":"Invulnerable for 5 sec."},
{"character_name":"Crown","skill_name":"Royal Attire","skill_slot":"Skill 2","target":"自身","target_type":"self","buff_type":"other","value":true,"value_unit":"boolean","duration":"5 sec","trigger":"Relaxが最大スタック時","condition":"全敵を挑発","stack_count":null,"max_raw_value":null,"source_url":"https://nikke.gg/characters/crown/","notes":"Taunt","source_text":"Attract: Taunt all enemies for 5 sec."},
{"character_name":"Crown","skill_name":"Royal Attire","skill_slot":"Skill 2","target":"自身","target_type":"self","buff_type":"hp_recovery_healing_potency","value":5.23,"value_unit":"caster_max_hp_percent","duration":"Instant","trigger":"Relaxが最大スタック時","condition":"HP回復","stack_count":null,"max_raw_value":5.23,"source_url":"https://nikke.gg/characters/crown/","notes":"","source_text":"Recovers 5.23% of the caster's final Max HP as HP."},
{"character_name":"Crown","skill_name":"Royal Attire","skill_slot":"Skill 2","target":"味方全員","target_type":"all_allies","buff_type":"attack_damage","value":20.99,"value_unit":"percent","duration":"7 sec","trigger":"回復効果発動時","condition":"Crownの回復が発動","stack_count":null,"max_raw_value":20.99,"source_url":"https://nikke.gg/characters/crown/","notes":"ATKと別カテゴリ","source_text":"Attack Damage ▲ 20.99% for 7 sec."},
{"character_name":"Crown","skill_name":"Last Kingdom","skill_slot":"Burst","target":"味方全員","target_type":"all_allies","buff_type":"attack_damage","value":36.24,"value_unit":"percent","duration":"15 sec","trigger":"Burst Skill使用時","condition":"","stack_count":null,"max_raw_value":36.24,"source_url":"https://nikke.gg/characters/crown/","notes":"","source_text":"Attack Damage ▲ 36.24% for 15 sec."},
{"character_name":"Crown","skill_name":"Last Kingdom","skill_slot":"Burst","target":"味方全員","target_type":"all_allies","buff_type":"other","value":10.45,"value_unit":"caster_max_hp_percent","duration":"15 sec","trigger":"Burst Skill使用時","condition":"Shield生成","stack_count":null,"max_raw_value":10.45,"source_url":"https://nikke.gg/characters/crown/","notes":"Shield","source_text":"Creates a Shield equal to 10.45% of the caster's final Max HP."},

{"character_name":"Red Hood","skill_name":"Glaring Eyes","skill_slot":"Skill 1","target":"自身","target_type":"self","buff_type":"charge_speed","value":3.81,"value_unit":"percent","duration":"5 sec","trigger":"通常攻撃時","condition":"10スタックまで","stack_count":10,"max_raw_value":38.1,"source_url":"https://nikke.gg/characters/red-hood/","notes":"1 stackあたりのRaw Value","source_text":"Charge Speed ▲ 3.81%, stacks up to 10 time(s)."},
{"character_name":"Red Hood","skill_name":"Glaring Eyes","skill_slot":"Skill 1","target":"自身","target_type":"self","buff_type":"charge_damage","value":240,"value_unit":"conversion","duration":"継続","trigger":"戦闘開始時","condition":"Charge Speedが100%を超えた分を変換","stack_count":null,"max_raw_value":null,"source_url":"https://nikke.gg/characters/red-hood/","notes":"超過値への変換率。実効値は算出しない","source_text":"Charge Damage ▲ 240% of the excess value continuously."},
{"character_name":"Red Hood","skill_name":"Wild Tooth","skill_slot":"Skill 2","target":"味方全員","target_type":"all_allies","buff_type":"caster_def_based_def","value":50.68,"value_unit":"caster_def_percent","duration":"10 sec","trigger":"Beast Cage中","condition":"Burst Iとして使用","stack_count":null,"max_raw_value":50.68,"source_url":"https://nikke.gg/characters/red-hood/","notes":"","source_text":"DEF ▲ 50.68% of caster's DEF for 10 sec."},
{"character_name":"Red Hood","skill_name":"Wild Tooth","skill_slot":"Skill 2","target":"自身","target_type":"self","buff_type":"hp_recovery_healing_potency","value":23.04,"value_unit":"percent","duration":"10 sec","trigger":"The Last Howl中","condition":"Burst IIとして使用","stack_count":null,"max_raw_value":23.04,"source_url":"https://nikke.gg/characters/red-hood/","notes":"攻撃ダメージに対するHP回復","source_text":"Recovers 23.04% of attack damage as HP for 10 sec."},
{"character_name":"Red Hood","skill_name":"Wild Tooth","skill_slot":"Skill 2","target":"自身","target_type":"self","buff_type":"caster_atk_based_atk","value":71.42,"value_unit":"caster_atk_percent","duration":"10 sec","trigger":"Red Wolf使用時","condition":"Burst IIIとして使用","stack_count":null,"max_raw_value":71.42,"source_url":"https://nikke.gg/characters/red-hood/","notes":"","source_text":"ATK ▲ 71.42% of caster's ATK for 10 sec."},
{"character_name":"Red Hood","skill_name":"Red Wolf","skill_slot":"Burst","target":"味方全員","target_type":"all_allies","buff_type":"caster_atk_based_atk","value":77.55,"value_unit":"caster_atk_percent","duration":"10 sec","trigger":"Beast Cage使用時","condition":"Burst Iとして使用","stack_count":null,"max_raw_value":77.55,"source_url":"https://nikke.gg/characters/red-hood/","notes":"","source_text":"ATK ▲ 77.55% of caster's ATK for 10 sec."},
{"character_name":"Red Hood","skill_name":"Red Wolf","skill_slot":"Burst","target":"自身","target_type":"self","buff_type":"burst_cooldown_reduction","value":40,"value_unit":"seconds","duration":"Instant","trigger":"Beast Cage / The Last Howl使用時","condition":"1戦闘につき1回","stack_count":null,"max_raw_value":40,"source_url":"https://nikke.gg/characters/red-hood/","notes":"Cooldown reduction","source_text":"Cooldown of Burst Skill ▼ 40 sec. Activates once per battle."},
{"character_name":"Red Hood","skill_name":"Red Wolf","skill_slot":"Burst","target":"自身","target_type":"self","buff_type":"hp_recovery_healing_potency","value":74.88,"value_unit":"percent","duration":"10 sec","trigger":"The Last Howl使用時","condition":"Burst IIとして使用","stack_count":null,"max_raw_value":74.88,"source_url":"https://nikke.gg/characters/red-hood/","notes":"HP Potency","source_text":"HP Potency ▲ 74.88% for 10 sec."},
{"character_name":"Red Hood","skill_name":"Red Wolf","skill_slot":"Burst","target":"自身","target_type":"self","buff_type":"other","value":true,"value_unit":"boolean","duration":"10 sec","trigger":"The Last Howl使用時","condition":"Burst IIとして使用。全敵を挑発","stack_count":null,"max_raw_value":null,"source_url":"https://nikke.gg/characters/red-hood/","notes":"Taunt","source_text":"Attract: Taunt all enemies for 10 sec."},
{"character_name":"Red Hood","skill_name":"Red Wolf","skill_slot":"Burst","target":"自身","target_type":"self","buff_type":"charge_speed","value":100.8,"value_unit":"percent","duration":"10 sec","trigger":"Red Wolf使用時","condition":"Burst IIIとして使用","stack_count":null,"max_raw_value":100.8,"source_url":"https://nikke.gg/characters/red-hood/","notes":"","source_text":"Charge Speed ▲ 100.8% for 10 sec."},

{"character_name":"Naga","skill_name":"Guardian of Friendship","skill_slot":"Skill 1","target":"味方全員","target_type":"all_allies","buff_type":"other","value":14.57,"value_unit":"percent","duration":"Instant","trigger":"通常攻撃12回後","condition":"CoverのHP回復","stack_count":null,"max_raw_value":14.57,"source_url":"https://nikke.gg/characters/naga/","notes":"Cover recovery","source_text":"Recovery of Cover's HP ▲ 14.57%."},